{
  "schemaVersion": 1,
  "specId": "SPEC-0004",
  "slug": "approval-example",
  "kind": "change",
  "risk": "R3",
  "status": "IMPLEMENTING",
  "artifacts": {
    "spec": "spec.md",
    "clarifications": "clarifications.md",
    "plan": "plan.md",
    "threatModel": "threat-model.md",
    "testPlan": "test-plan.md",
    "tasks": "tasks.md",
    "traceability": "traceability.md",
    "convergence": null,
    "changeRecord": null
  },
  "statusHistory": [
    {
      "status": "DRAFT",
      "date": "2026-01-01"
    },
    {
      "status": "CLARIFYING",
      "date": "2026-01-02"
    },
    {
      "status": "READY_FOR_PLAN",
      "date": "2026-01-03"
    },
    {
      "status": "PLANNED",
      "date": "2026-01-04"
    },
    {
      "status": "READY_FOR_APPROVAL",
      "date": "2026-01-05"
    },
    {
      "status": "APPROVED_FOR_IMPLEMENTATION",
      "date": "2026-01-06"
    },
    {
      "status": "IMPLEMENTING",
      "date": "2026-01-07"
    }
  ],
  "approvals": [
    {
      "gate": "specification",
      "role": "Product Owner",
      "actorType": "human",
      "decision": "approved",
      "evidenceRef": "sample",
      "date": "2026-01-05"
    },
    {
      "gate": "architecture",
      "role": "Solution Architect",
      "actorType": "human",
      "decision": "approved",
      "evidenceRef": "sample",
      "date": "2026-01-05"
    }
  ],
  "reviews": [],
  "evidenceConflicts": []
}
