{
  "schemaVersion": 1,
  "specId": "SPEC-0002",
  "slug": "normal-example",
  "kind": "change",
  "risk": "R2",
  "status": "CONVERGED",
  "artifacts": {
    "spec": "spec.md",
    "clarifications": null,
    "plan": "plan.md",
    "threatModel": null,
    "testPlan": "test-plan.md",
    "tasks": "tasks.md",
    "traceability": "traceability.md",
    "convergence": "convergence.md",
    "changeRecord": null
  },
  "statusHistory": [
    {
      "status": "DRAFT",
      "date": "2026-01-01"
    },
    {
      "status": "READY_FOR_PLAN",
      "date": "2026-01-02"
    },
    {
      "status": "PLANNED",
      "date": "2026-01-03"
    },
    {
      "status": "READY_FOR_APPROVAL",
      "date": "2026-01-04"
    },
    {
      "status": "APPROVED_FOR_IMPLEMENTATION",
      "date": "2026-01-05"
    },
    {
      "status": "IMPLEMENTING",
      "date": "2026-01-06"
    },
    {
      "status": "VERIFYING",
      "date": "2026-01-07"
    },
    {
      "status": "CONVERGED",
      "date": "2026-01-08"
    }
  ],
  "approvals": [
    {
      "gate": "specification",
      "role": "Product Owner",
      "actorType": "human",
      "decision": "approved",
      "evidenceRef": "sample",
      "date": "2026-01-04"
    }
  ],
  "reviews": [
    {
      "type": "code-review",
      "role": "Engineering Reviewer",
      "actorType": "human",
      "decision": "approved",
      "evidenceRef": "sample",
      "date": "2026-01-07"
    }
  ],
  "evidenceConflicts": []
}
